Location_Name,Address,Zip,City,Latitude,Longitude,Geometry,URL,Category,Description,Type,Service,Target_Group
Test- und Anwendungszentrum L.I.N.K.,Nordostpark 84,90411,Nürnberg,49.4863731316473,11.129022709304,Point,https://www.iis.fraunhofer.de/de/profil/standorte/linkhalle.html,Technologietransferzentrum,"Das Test- und Anwendungszentrum L.I.N.K. am Fraunhofer IIS in Nürnberg ist auf die Entwicklung und Evaluierung zukunftsweisender Technologien spezialisiert, insbesondere in den Bereichen Lokalisierung, Identifikation, Navigation und Kommunikation. Das Zentrum bietet eine einzigartige Testinfrastruktur und technologieorientierte Beratungsdienstleistungen für Unternehmen und Forschungseinrichtungen.","Test- und Forschungszentrum, angewandte Forschungs- und Entwicklung","Entwicklung und Evaluierung zukunftsweisender Technologien, Technologieberatung und Systemevaluation","Industriepartner, Forschungseinrichtungen, Unternehmen, Wissenschaftscommunity"
tollwerkstatt,Klingenhofstraße 5,90411,Nürnberg,49.4750908143014,11.107075249316,Point,https://tollwerkstatt.de/,HackerSpace,"Die tollwerkstatt, ein Projekt der Web- und Werbeagentur tollwerk in Nürnberg, bietet seit 2016 eine Plattform für kreative Tech-Events. Mit dem Ziel, die lokale IT- und Open-Source-Community zu fördern, stellt sie einen Raum für regelmäßige Treffen, offenen Wissensaustausch und kreative Veranstaltungen zur Verfügung. Der Werkstattcharakter der Räumlichkeiten fördert eine unkonventionelle und kreative Atmosphäre.",Veranstaltungs- und Workshopraum,"Plattform für Meetups, Workshops, kreative Tech-Events, Unterstützung der IT- und Open-Source-Community","IT- und Open-Source-Community, Entwickler, Kreative"
Twostay Coworking Nürnberg x Sausalitos,Färberstraße 10,90402,Nürnberg,49.4498557000000,11.072696600000,Point,https://twostay.work/,Coworking Space,"TwoStay bietet ein innovatives Coworking-Konzept, das ungenutzte Räume in Hotels, Restaurants, Bars und Einkaufszentren in München und Frankfurt in kreative und flexible Arbeitsplätze verwandelt. Die Pläne sind flexibel und beinhalten alles, was man zum Arbeiten braucht, von Hot Desks bis hin zu Breakout-Räumen und Fokus-Bereichen. TwoStay eignet sich für Personen, die eine flexible und inspirierende Arbeitsumgebung suchen und dabei nur für die tatsächliche Nutzung zahlen möchten.",Flexible Arbeitsplatzlösungen,"Flexible Arbeitsplätze und Meetingräume, Schreibtische, Breakout-Räume, Fokus-Bereiche, Pläne ab 6€, multifunktionale Räume für Fotoshootings, Yoga usw., Hotel-Lobbys, Retail-Plätze, leere Stockwerke, Restaurants, Bars und Einkaufszentren als Coworking-Orte","Freiberufler, Selbständige, Kreative, Programmierer, Teams"
Urban Lab Nürnberg,Frankenstraße 200,90461,Nürnberg,49.4301337000000,11.094497300000,Point,https://www.urbanlab-nuernberg.de/,MakerSpace,"Das Urban Lab Nürnberg ist ein Labor für urbane Experimente und Gestaltung. Es ermöglicht Menschen, aktiv an der Gestaltung ihrer Stadt teilzunehmen. Mit einem Fokus auf Nachhaltigkeit und Interdisziplinarität, arbeitet das Urban Lab an Lösungen, um Städte grüner und lebenswerter zu machen.","Urbanes Experimentier- und Gestaltungslabor, Makerspace","Forschung und Entwicklung urbaner Lösungen, Partizipative und co-kreative Arbeitsweise, Unterstützung und Prototyping für städtische Projekte","Stadtplaner, Architekten, Bürger, Maker"
Venquis Nürnberg (Design Offices Nürnberg City),Königstorgraben 11,90402,Nürnberg,49.4488372802734,11.082666397095,Point,https://www.venquis.com/de/,Coworking Space,,Coworking Space,"Serviced Office Office, Coworking, Virtual Office, Events, Meeting & Conference Space.","Freiberufler, Selbständige, Programmierer, Teams, Unternehmen"
W2G Offices,Rudolf-Breitscheid-Straße 51,90762,Fürth,49.4704206500000,10.996739079067,Point,https://www.w2g-offices.de/,Coworking Space,"W2G Offices in Fürth bietet ein modernes Arbeitsumfeld, das sich durch lichtdurchflutete Räume und eine klare, besondere Atmosphäre auszeichnet. Die Räumlichkeiten sind für flexible Arbeitsweisen konzipiert und bieten eine Vielzahl an Services, die es den Nutzern ermöglichen, sich auf ihre Kernarbeit zu konzentrieren. Das Konzept von W2G Offices fördert einen offenen Gedanken- und Ideenaustausch sowie bereicherndes Networking.","Moderner Arbeitsplatz, Eventlocation","Vermietung von Arbeitsplätzen, Meeting- und Trainingsräumen, leichtes Arbeiten mit ""leichtem Gepäck"", umfassende technische und organisatorische Unterstützung, offener Gedanken- und Ideenaustausch, Networking","Freiberufler, Selbständige, Teams, Unternehmen"
Werk Eins Makerspace,Schwabacher Straße 512,90763,Fürth,49.4381423131461,10.993510806133,Point,http://werk-eins.com/,MakerSpace,"Werk Eins bietet auf einem gemischten Gewerbestandort von knapp 18.000 Quadratmetern Flächen für diverse Nutzungszwecke. Der Standort eignet sich für Unternehmen, die flexiblen Raum für Büro, Produktion, Labor und andere Zwecke benötigen. Die Werk Eins Lounge bietet eine einzigartige Location im Industrielook für diverse Veranstaltungen und ist exklusiv für Mieter, deren Mitarbeiter, Kunden und Geschäftspartner zugänglich.",Gewerbestandort mit vielfältigen Nutzungsmöglichkeiten,"Mietflächen für Büro, Produktion, Labor, Ausstellung, Lager, Fotostudio, Werkstatt uvm., Werk Eins Lounge für Veranstaltungen wie Teammeetings, Mitarbeiterschulungen, Kundenpräsentationen, Workshops, Hackathons oder Privatveranstaltungen","Unternehmen, Institutionen, Start-ups"
WORK | IN Fürth - Coworking Space,Gebhardtstraße 5,90762,Fürth,49.4701891499999,10.992413330965,Point,http://www.workinfuerth.de/,Coworking Space,"WorkIn Fürth bietet in einem historischen Gebäude nahe des Hauptbahnhofs moderne und flexible Arbeitsräume an. Es ist ideal für Unternehmer, Kreative und Startups, die ein lebendiges Netzwerk und professionelle Arbeitsbedingungen suchen. Das Konzept fördert Agilität, Kollaboration und Innovation in einer inspirierenden Umgebung.",Moderner Arbeitsraum in einem charmanten Altbau,"Flexible Arbeitsplätze, Meeting- und Trainingsräume, kostenloses WLAN, Kaffee, Wasser und Snacks, Postempfang, Workshopzubehör, Beamer, Rollcontainer, Marktplatz zum Netzwerken","Freiberufler, Selbständige,Programmierer, Teams, Unternehmen"
workspaceIn Stadtpark - Coworking Space Nürnberg,Virchowstraße 20,90409,Nürnberg,49.4677073000000,11.095644356017,Point,http://workspacein.de/,Coworking Space,"WorkspaceIN bietet in Nürnberg ein professionelles und modernes Coworking-Erlebnis. Nutzer können von einem Arbeitsplatz mit Gartenblick oder von der Dachterrasse aus arbeiten. Die Räumlichkeiten sind modern ausgestattet und bieten alles Notwendige für produktives Arbeiten, einschließlich schnellem Internet und moderner Präsentationstechnologie. WorkspaceIN eignet sich ideal für Berufstätige und Unternehmen, die flexible Arbeitsplätze mit hohem Komfort suchen.",Modernes und professionelles Arbeitsumfeld,"24/7 Zugang, moderne Einrichtung, schnelles Internet, Präsentationstechnik auf dem neuesten Stand, attraktive Meetingräume","Freiberufler, Selbständige,Programmierer, Geschäftsreisende, Teams, Unternehmen"
workspaceIn Stresemanplatz - Coworking Space Nürnberg,Sulzbacher Str. 48,90489,Nürnberg,49.4584412000000,11.095480100000,Point,https://workspacein.de/,Coworking Space,"WorkspaceIN bietet in Nürnberg ein professionelles und modernes Coworking-Erlebnis. Nutzer können von einem Arbeitsplatz mit Gartenblick oder von der Dachterrasse aus arbeiten. Die Räumlichkeiten sind modern ausgestattet und bieten alles Notwendige für produktives Arbeiten, einschließlich schnellem Internet und moderner Präsentationstechnologie. WorkspaceIN eignet sich ideal für Berufstätige und Unternehmen, die flexible Arbeitsplätze mit hohem Komfort suchen.",Modernes und professionelles Arbeitsumfeld,"24/7 Zugang, moderne Einrichtung, schnelles Internet, Präsentationstechnik auf dem neuesten Stand, attraktive Meetingräume","Freiberufler, Selbständige,Programmierer, Geschäftsreisende, Teams, Unternehmen"
XR Hub Bavaria - Nürnberg,Obermaierstraße 7,90408,Nürnberg,49.4709108539942,11.073072000000,Point,https://www.xrhub-nue.de/,Cluster & Innovationsagentur,"Der XR HUB Nürnberg ist Teil des XR HUB Bavaria, einer Initiative zur Stärkung des Medien- und Wirtschaftsstandorts Bayern. Es bietet Beratung, Unterstützung und Weiterbildungsangebote im Bereich Extended Reality und fördert die Vernetzung von Akteuren aus verschiedenen Technologiebereichen in der Metropolregion. Der XR HUB Nürnberg konzentriert sich auf die Aufklärung und den Zugang zu XR-Technologien und schafft Verbindungen zu anderen Technologiefeldern.",Initiative zur Förderung der Medien- und Wirtschaftsstandorts Bayern,"Beratung und Unterstützung im Bereich Extended Reality, Vernetzung von Akteuren aus unterschiedlichen Technologiebereichen in der Metropolregion, Aus- und Weiterbildungsveranstaltungen für Unternehmen und Interessierte, Berufsfelderkundung und Jobmöglichkeiten für Schüler:innen und Studierende im Bereich XR, Anregungen und Input für XR als Querschnittsthema in verschiedenen Bereichen","Unternehmen, Schüler:innen, Studierende, Interessierte an XR-Technologien"
Zentrum für Austausch und Machen (ZAM),Hauptstraße 65-67,91054,Erlangen,49.6000372000000,11.072689447156,Point,https://www.zam.haus/,MakerSpace,"ZAM in Erlangen ist ein Ort, der die Freude am (Selber-)Machen fördert und eine Plattform für kreative, technische und künstlerische Projekte bietet. Es bietet Werkstätten und Räume für gemeinschaftliches Arbeiten und ist ein Treffpunkt für Menschen, die Ideen umsetzen und sich in einer offenen und unterstützenden Umgebung austauschen wollen.",Gemeinnütziger Verein,"Offene Werkstätten und Projektflächen, Förderung des (Selber-)Machens in Gemeinschaft, Zugang zu Fertigungstechniken, Werkstätten für Holz und Metall, Textil, Farbe und Druck, digitale Fertigung, Elektronik, Biowerkstatt","Bürger, Maker, Kreative"
ZOLLHOF – Tech Incubator,Zollhof 7,90443,Nürnberg,49.4436400000000,11.069080000000,Point,https://zollhof.de/,"Gründerzentrum, Accelerator","Der ZOLLHOF – Tech Incubator ist eine Einrichtung, die sich auf die Unterstützung von Start-ups und Unternehmensgründern spezialisiert. Sie bieten Bürovermietung, Inkubations- und Innovationsprogramme an, die sich insbesondere an Start-ups und Studenten richten. Der ZOLLHOF fördert Innovation und Unternehmertum durch die Bereitstellung von Ressourcen und die Vernetzung mit der Wirtschaft.","Gründerzentrum, Digitalisierung, Medizintechnik","Bürovermietung, Inkubationsprogramme, Innovationsprogramme für Studenten, Netzwerkveranstaltungen, Beratungsunternehmen","Start-ups, Studierende, Unternehmengründer, Forschungseinrichtungen"
