Location_Name,Address,Zip,City,Latitude,Longitude,Geometry,URL,Category,Description,Type,Service,Target_Group
Innovation Lab for Wearable and Ubiquitous Computing,Carl-Thiersch-Straße 2b,91052,Erlangen,49.5946398000000,11.026177700000,Point,https://www.mad.tf.fau.de/teaching/innolab/#collapse_21,"Universitäre und außeruniversitäre Forschung, Innovationslabor","Das Innovation Lab for Wearable and Ubiquitous Computing an der FAU bietet Studierenden die Möglichkeit, praktische Fragestellungen im Bereich System- und Software-Engineering im Kontext von Wearables und IoT-Geräten kreativ und innovativ zu lösen. Das Labor bietet eine Infrastruktur zur Umsetzung eigener Produktideen oder zur Arbeit an Themen von Industriepartnern und der Universität.",Labor für tragbare und allgegenwärtige Computertechnologien,"Entwicklung und Erprobung von Technologien für Wearables und Ubiquitous Computing, Zusammenarbeit mit Industriepartnern und der Universität","Studierende, Forschende, Industriepartner"
Innovationslabor Industrial IoT,Nordostpark 84,90411,Nürnberg,49.4861912292713,11.128762090612,Point,https://www.iis.fraunhofer.de/de/ff/lv/Innovationslabor.html,Innovationslabor,"Das Innovationslabor Industrial IoT am Fraunhofer IIS bietet Unternehmen eine einzigartige Testumgebung für Industrie 4.0-Anwendungen. Das Labor ermöglicht die Entwicklung, Erprobung und das Testen von Lokalisierungs- und Kommunikationstechnologien und bietet eine umfassende Infrastruktur für die Digitalisierung von Industrieprozessen.","Forschungs- und Entwicklungslabor, Digitalisierung","Entwicklung, Erprobung und Testen von Lokalisierungs- und Kommunikationstechnologien, Individuelle Lösungen und Prototypenentwicklung, 1.400 Quadratmeter Hallen- und Laborfläche für Indoor- und Outdooranwendungen","Industriepartner, Unternehmen, Forschungseinrichtungen"
Institute for Healthcare Robotics and Automation (IFOHRA),Am Werkkanal 6,96047,Bamberg,49.9035033000000,10.868323500000,Point,https://www.ifohra.de/,"Universitäre und außeruniversitäre Forschung, Technologietransferzentrum","Das IFOHRA kombiniert Expertise aus dem Gesundheitswesen und der Industrie, um innovative, humanzentrierte Lösungen zur Effizienzsteigerung im Gesundheitsbereich zu entwickeln und umzusetzen. Es bietet einen Health Check, um Prozesse sowohl qualitativ als auch quantitativ zu bewerten und arbeitet eng mit wissenschaftlichen Beratern zusammen.","Forschungs- und Entwicklungsinstiut, Technologietransferzentrum","Entwicklung von robotik- und automatisierungsbasierten Lösungen für das Gesundheitswesen, Prozessanalyse, Realisierung von individuellen, auf Business Cases basierten Lösungen, Implementierung zukunftsweisender Technologien","Gesundheitsdienstleister, Krankenhäuser, medizinische Einrichtungen"
IT-Cluster Oberfranken,Kronacher Straße 41,96052,Bamberg,49.9176997000000,10.897897100000,Point,https://www.it-cluster-oberfranken.de/,Cluster & Innovationsagentur,"Das IT-Cluster Oberfranken ist ein regionales Netzwerk, das sich der Förderung von IT-Themen und der Vernetzung von Unternehmen und Institutionen in Oberfranken widmet. Es organisiert regelmäßige Events und Workshops und dient als Wissens- und Wachstumspool in der IT-Branche.",Regionales Netzwerk für IT-Unternehmen und Institutionen,"Vernetzung von Unternehmen und Institutionen, Förderung von IT- und Zukunftsthemen, Veranstaltungen, Workshops, Meetups","Unternehmen aus IT, Institutionen, Start-ups, Wissenschaftler"
JOSEPHS - Das offene Innovationslabor,Augustinerstraße 19,90403,Nürnberg,49.4539821000000,11.074704600000,Point,https://josephs-innovation.de/wp/,Innovationslabor,"Das JOSEPHS ist ein offenes Innovationslabor, das Menschen die Möglichkeit bietet, an der Entwicklung zukünftiger Innovationen teilzunehmen. Besucher können hier neue Ideen entdecken, ausprobieren und durch ihr Feedback mitgestalten. Das JOSEPHS verfolgt einen partizipativen und co-kreativen Ansatz und dient als Plattform für die gemeinsame Entwicklung von zukunftsweisenden Lösungen.","Innovations- und Kreativitätszentrum, Open Innovation","Erlebniswelt für Innovationen, Co-Kreation und partizipative Entwicklung, Veranstaltungen und Workshops","Hochschulen, Kreative, Innovatoren"
Klee-Center GmbH Existenzgründerzentrum,Kleestraße 21-23,90461,Nürnberg,49.4338290000000,11.091711500000,Point,https://www.kleecenter.de/,Gründerzentrum,"Das Klee-Center bietet Existenzgründern aus allen Branchen eine Plattform zum Start und Wachstum ihres Unternehmens. Es stellt attraktive und flexible Büroflächen, zentrale Infrastruktur- und Serviceleistungen sowie ein Netzwerk für Unternehmer und freiberuflich Tätige bereit.",Gründerzentrum,"Gründerberatung, Bürovermietung, Seminarraumvermietung, Beratungsunternehmen","Start-ups, Studierende, Unternehmengründer, Forschungseinrichtungen"
Kraftwerk Erba,An d. Spinnerei 1,96047,Bamberg,49.9021350000000,10.869442969481,Point,https://kraftwerk-erba.space/,"Coworking Space, Accelerator","Das Kraftwerk ERBA auf der Erba-Insel in Bamberg bietet einen innovativen Space, der sowohl Coworking-Plätze als auch einen Accelerator für Startups umfasst. Es bietet zudem Raum für Veranstaltungen und Meetings in einer historischen und inspirierenden Umgebung. Die Vision des Kraftwerks ERBA ist es, die Innovations- und Netzwerkkultur in Bamberg zu steigern und wertvolle Synergien zu schaffen.",Innovativer Space im denkmalgeschützten Wasserkraftwer,"Arbeitsplätze für Coworker, Unterstützung für Startups durch Mentoren und Coachings, Vermittlung zu Investoren, Raum für Events und Meetings","Freiberufler, Selbständige, Programmierer, Teams, Unternehmen"
LAGARDE1,Nathan-R.-Preston-Straße 1,96052,Bamberg,49.9064598083496,10.917963027954,Point,https://lagarde1.de/,"Gründerzentrum,Accelerator,"Das LAGARDE1 in Bamberg unterstützt Start-ups und Gründungsinteressierte dabei, das Beste aus ihren Ideen zu machen und bietet eine Plattform für Vernetzung und Zusammenarbeit. Mit verschiedenen Angeboten wie Coworking Spaces, Büros und Veranstaltungen schafft das Zentrum ein inspirierendes Umfeld für innovative Unternehmensgründungen.",Zentrum für Start-ups und Unternehmen,"Unterstützung von Gründungsinteressierten und Start-ups, Vernetzung, Coworking, Büros, Events","Start-ups, Studierende, Unternehmengründer, Forschungseinrichtungen"
LEONARDO – Zentrum für Kreativität und Innovation,Karl-Grillenberger-Straße 3a,90402,Nürnberg,49.4517326354980,11.070027351379,Point,https://leonardo-zentrum.de/,"Innovationslabor, Coworking Space","Das LEONARDO – Zentrum für Kreativität und Innovation in Nürnberg ist eine Kooperation zwischen verschiedenen Hochschulen und zielt darauf ab, die interdisziplinäre Zusammenarbeit in den Bereichen Lehre, Forschung und Transfer zu fördern. Es bietet eine Plattform für die Entwicklung und Realisierung kreativer und innovativer Ideen und veranstaltet verschiedene Workshops und Veranstaltungen zur Förderung dieser Ziele.","Innovations- und Kreativitätszentrum, Open Innovation","Förderung interdisziplinärer Zusammenarbeit, Unterstützung innovativer Projektideen, Veranstaltungen und Workshops","Hochschulen, Kreative, Innovatoren"
LETRA Haus,Karolinenstraße 17,90763,Fürth,49.4702233000000,10.986689456250,Point,http://www.letrafactory.de/,Coworking Space,"Die LETRA FACTORY bietet in einem stilvollen Co-Working-Ambiente im ehemaligen Fabrik- und Geschäftsgebäude der Firma Lederwaren Trautner, ein historisches Baudenkmal der Stadt Fürth, professionelle Büroarbeitsplätze an. Sie ist sowohl für individuelles Arbeiten als auch für Meetings und Gespräche geeignet und bietet eine inspirierende Atmosphäre für kreative Arbeit.",Professionelle Büroarbeitsplätze,"Feste Arbeitsplätze (Fix-Desk), Zone für Meetings und Besprechungen, Webspace unter letrafactory.de, Küche mit Kühlschrank und Kochgelegenheit, verschiedene Bereiche für Entspannung und Gespräche, eigene Postanschrift","Freiberufler, Selbständige, Programmierer, Teams, Unternehmen"
Medical Valley Center Bamberg,Promenadestraße 6a,96047,Bamberg,49.8939498000000,10.892179000000,Point,https://medical-valley-bamberg.de/,"Universitäre und außeruniversitäre Forschung, Technologietransferzentrum, Innovationslabor, Gründerzentrum",Das Medical Valley Center Bamberg konzentriert sich auf die Förderung von Innovationen im Gesundheitssektor und dient als Magnet für Unternehmen und Forschungseinrichtungen in diesem Bereich. Mit einem geplanten Gebäude auf dem Lagarde-Campus soll eine innovative Infrastruktur für die Gesundheitsversorgung und Medizintechnik in Bamberg geschaffen werden.,"Forschungs- und Entwicklungszentrum, Gründerzentrum","Entwicklung zukunftsweisender Innovationen in der Gesundheitswirtschaft, enge Vernetzung zwischen Forschung, Gesundheitsdienstleistern und Patienten in der Region, Unterstützung von Unternehmen und Start-ups","Unternehmen der Gesundheitsbranche, Forschungseinrichtungen, Patienten, Gesundheitsdienstleister"
Neo Bamberg,Pestalozzistraße 10,96052,Bamberg,49.9098321000000,10.916570600000,Point,https://neo-bamberg.de/,"HackerSpace, MakerSpace","NEO Bamberg ist ein Kreativ- und Technikzentrum, das Kinder und Jugendliche in die Welt der Mathematik, Informatik, Naturwissenschaften, Technik und Kreativität einführt. Es bietet diverse Angebote, die von spielerischen Einstiegen in die digitale Welt bis hin zu spezifischen Projekten in verschiedenen Altersgruppen reichen. Das Ziel von NEO ist es, junge Menschen spielerisch und kreativ an technische und naturwissenschaftliche Themen heranzuführen und ihnen Raum für die Entwicklung eigener Ideen zu geben.",Außerschulischer Techniklernort,"Spielerischer Einstieg in die digitale Welt, Grundlagen des Programmierens, Kennenlernen von Werkzeugen und Baumaterialien, Entwicklung von Ideen, kreatives Ausleben",Kinder und Jugendliche
Nerdberg e.V.,Jakobinenstraße 26,90762,Fürth,49.4704533000000,11.003323100000,Point,https://wiki.nerdberg.de/Hauptseite,HackerSpace,"Nerdberg e.V. ist ein Ort für Kreativität und technischen Austausch in Nürnberg. Der Verein bietet einen Raum, in dem sich Personen mit Interesse an Technologie, Hacking und ähnlichen Themen treffen und austauschen können. Mit einer offenen und einladenden Atmosphäre richtet Nerdberg regelmäßige Veranstaltungen und Workshops aus, um Wissen zu teilen und die Gemeinschaft zu fördern.",Hackgruppe,"Hackspace für Nerds, Hacker, Geeks und andere dem Chaosumfeld affine Personen, regelmäßige Treffen, Vorträge & Workshops","Programmierer, Nerds, Hacker, Geeks, Interessierte an Technologie"
Neu-Raum Erlangen,Heuwaagstraße 10,91054,Erlangen,49.5988726000000,11.002463400000,Point,https://www.neu-raum.info/,Coworking Space,"NEU-RAUM in Erlangen ist ein inspirierender Ort, der Räume für Gespräche, Workshops und persönliche Weiterentwicklung bietet. Er richtet sich an Menschen, die ihre Ideen entwickeln, weiterentwickeln und in einem kreativen Umfeld austauschen möchten. NEU-RAUM fördert die positive Energie und Kreativität in seinen Räumen und bietet ein buntes Angebot für die persönliche und berufliche Entwicklung.",Inspirierender Ort für Ideen und Austausch,"Räume für Gespräche und Workshops, Angebot für persönliche Weiterentwicklung, positive Energie in Räumen","Freiberufler, Selbständige, Kreative"
NIK e.V. | Netzwerk der Digitalwirtschaft,Obermaierstraße 7,90408,Nürnberg,49.4710990965402,11.072783326928,Point,https://www.nik-nbg.de/,Cluster & Innovationsagentur,"Das NIK e.V. ist ein Netzwerk, das sich der Förderung der Digitalwirtschaft in der Region Nürnberg widmet. Es vernetzt Unternehmen, Hochschulen, Kommunen und Institutionen und unterstützt sie bei der digitalen Transformation durch Austausch, Impulse und Informationsbereitstellung.","Digitalwirtschaftsnetzwerk, Cluster, Digitalisierung","Austausch und neue Kontakte, Impulse und neue Ideen, Informationen und neue Trends","Unternehmen, Hochschulen, Institutionen, Forschungseinrichtungen, Branchenakteure"
"NKubator - Innovation- und Gründerzentrum für Energie, Greentech und Nachhaltigkeit",Fürther Straße 244a,90429,Nürnberg,49.4600702000000,11.031484400000,Point,http://www.nkubator.de/,"Gründerzentrum, Accelerator","Das NKubator scheint sich auf die Unterstützung von Start-ups im Bereich Energie, Greentech und Nachhaltigkeit zu konzentrieren. Es bietet verschiedene Dienstleistungen wie Coachings und Workshops an","Gründerentrum für Energie, Greentech und Nachhaltigkeit","Unterstützung technologieorientierter Start-ups, Coachings, Workshops, Nachhaltigkeits-Check","Start-ups, Studierende, Unternehmengründer"
Nuremberg Campus of Technology,Fürther Str. 246b,90429,Nürnberg,49.4601525000000,11.029920800000,Point,https://www.th-nuernberg.de/einrichtungen-gesamt/wissenschaftliche-und-forschungskooperationen/nuremberg-campus-of-technology/,"Universitäre und außeruniversitäre Forschung, Technologietransferzentrum","Der Nuremberg Campus of Technology ist ein Think Tank für Smart City-Lösungen. Er fokussiert auf die Entwicklung neuer Konzepte in Automatisierungstechnik, Energie- und Speichertechnologien, intelligenter Verkehrsplanung und nachhaltigkeitsorientiertem Innovationsmanagement.","Forschungs- und Entwicklungszentrum, Smart Cities","Forschung in Smart Cities Lösungen, Automatisierungstechnik, Energie- und Speichertechnologien, Intelligente Verkehrsplanung","Forschende, Studierende, Industriepartner"
Nürnberg Messe,Messezentrum,90471,Nürnberg,49.4165950000000,11.121889900000,Point,https://www.nuernbergmesse.de/,Cluster & Innovationsagentur,"Die NürnbergMesse ist eine der führenden Messegesellschaften weltweit und organisiert Fachmessen und Kongresse in Nürnberg und international. Sie bietet eine Plattform für Innovationen, Geschäftsentwicklung und Networking in verschiedenen Branchen.","Veranstalter von Messen, Kongressen und Events","Organisation und Durchführung von Fachmessen und Kongressen in verschiedenen Branchen, darunter Building & Construction, Electronics & Security, Process Technology, Retail & Consumer Goods sowie Social & Public","Aussteller, Besucher, Branchenakteure"
Nürnberg Workspace,Regensburger Str. 334A,90480,Nürnberg,49.4319622000000,11.129792100000,Point,https://www.nuernberg-workspace.de/,Coworking Space,"Nürnberg Workspace bietet flexible Arbeitsmöglichkeiten in einer professionellen Umgebung. Mit einer Vielzahl an Raumoptionen, von Konferenzräumen über Einzelbüros bis hin zu Coworking Spaces, ist es ideal für Freelancer, Startups und Unternehmen. Die Ausstattung umfasst unter anderem WLAN, Parkplätze und einen Snackautomaten, was die tägliche Arbeit komfortabel und effizient gestaltet.",Professionelle Arbeitsumgebung,"Flexible Büro-, Meeting- und Coworkingflächen, Konferenzräume, Projekträume, Einzelbüros, 2er Büros, kostenloses WLAN, kostenlose Parkplätze, Snackautomat","Freiberufler, Selbständige, Programmierer, Teams, Unternehmen"
Nürnberger Hackspace K4CG,"Königstraße 93, 90402 Nürnberg",90402,Nürnberg,49.4487901000000,11.081974300000,Point,https://k4cg.org/index.php/N%C3%BCrnberger_Hackspace_K4CG,HackerSpace,"Die K4 Computergruppe (K4CG), Teil der Offenen Werkstätten im Künstlerhaus Nürnberg, ist ein offener Raum für alle, die sich für Technik begeistern. Hier finden regelmäßige Treffen und Workshops statt, und die Gruppe unterstützt beim Umgang mit verschiedenen Betriebssystemen und technischen Herausforderungen. Sie bietet auch eine Plattform für Austausch und Networking in der lokalen Technologie-Community.",Hackgruppe,"Regelmäßige Treffen, Chaostreff, Vorträge und Workshops, Support für Linux/BSD/macOS/Windows-Nutzer:innen, Hilfe beim Programmieren, Löten, 3D-Drucken","Programmierer, Nerds, Hacker, Geeks, Interessierte an Technologie"
Offene Werkstatt Bamberg,Weißenburgstraße 10,96052,Bamberg,49.9034691000000,10.913020500000,Point,https://www.owba.de/,MakerSpace,"Die Offenen Werkstätten Bamberg e.V. bieten einen Raum für kreative und handwerkliche Tätigkeiten. Sie sind mit verschiedenen Werkzeugen und Geräten ausgestattet und ermöglichen es Mitgliedern der Gemeinschaft, Projekte zu verwirklichen, Fähigkeiten zu erlernen und sich gegenseitig zu inspirieren. Der Verein legt Wert auf gegenseitige Unterstützung und das gemeinsame Lernen und Schaffen.",Gemeinnütziger Verein,"Maschinen, Geräte, Werkzeuge, Platz zum Arbeiten, Austausch und gegenseitige Inspiration, Unterstützung durch Thekenkräfte","Bürger, Maker, Kreative"
Office Club Nürnberg FrankenCampus,Frankenstraße 152,90461,Nürnberg,49.4285555000000,11.088841200000,Point,https://www.officeclub.com/standorte/coworking-space-business-center-nuernberg-frankencampus-office-club,Coworking Space,"Der Office Club Nürnberg FrankenCampus bietet ein modernes Arbeitsumfeld im Businesspark „FrankenCampus“ in der Nürnberger Südstadt. Der Standort verfügt über eine hervorragende Verkehrsanbindung und bietet flexibel nutzbare Räumlichkeiten für Coworking, Meetings und Events. Die umfangreichen Services und Annehmlichkeiten tragen zur Produktivität und zum Komfort der Nutzer bei.","Arbeitsplatz, Meeting- und Eventraum","Flexible Arbeitsplätze, Büroräume & Feste Arbeitsplätze, Konferenzräume, Geschäftsadresse, Virtuelles Büro, Multifunktionsdrucker, Club-Café/Kitchen, umfassender Postservice, hochwertige Einrichtung, Highspeed Internet, unkompliziertes Netzwerken, sichere Arbeitsplätze, freundliches Team vor Ort, Gemeinschaftsbereiche, Büroreinigung","Freiberufler, Selbständige,Programmierer, Geschäftsreisende, Teams, Unternehmen"
Ohm Innovation Center,"Auf AEG, Muggenhofer Straße",90429,Nürnberg,49.4606570000000,11.029371000000,Point,https://www.th-nuernberg.de/forschung-innovation/forschungseinrichtungen/ohm-innovation-center/,Innovationslabor,"Das Ohm Innovation Center „Auf AEG“ wird ab Herbst 2024 das Zentrum der angewandten Forschung der Technischen Hochschule Nürnberg bilden. Es zielt darauf ab, technologische, soziale, ökonomische und kulturelle Innovationen, insbesondere in Zusammenarbeit mit Industrie, Startups, KMU und anderen Organisationen, in der Metropolregion Nürnberg voranzutreiben. Das Zentrum wird ein Umfeld bieten, das die Erarbeitung von Forschungsergebnissen, die Gründung von Unternehmen und die Initiierung von Innovationen fördert.",Zentrum der angewandten Forschung,"Entwicklung von Forschungsergebnissen, Unterstützung bei Unternehmensgründungen und technologischen sowie sozialen Innovationen","Forschende, Unternehmen, Start-ups, Forschungseinrichtungen, Institutionen"
OM7 – Gründungs- und Kreativwirtschaftszentrum,Obermaierstraße 7,90408,Nürnberg,49.4709265791555,11.072800939448,Point,https://www.om7.de/,"Gründerzentrum, Innovationslabor, Coworking Space","Das OM7 ist ein Ort für interdisziplinären Austausch und Wissenstransfer, der sich auf die Unterstützung von Gründenden und Unternehmer*innen der Kreativwirtschaft konzentriert. Es bietet eine Vielzahl von Dienstleistungen und Programmen zur Förderung von Innovationen und kreativen Geschäftsmodellen.",Business Innovation Center für Existenzgründungen und junge Unternehmen der Kreativwirtschaft,"Open Innovation, Kreativ Garage (Gründungsprogramm), Kreativ Punkt (Veranstaltungsformate), Kreativ Labor (Businessworkshops), Coworking, Seminarräume","Start-ups, Studierende, Unternehmengründer, Forschungseinrichtungen, Kreative, Innovatoren"
Open Device Lab Nürnberg,Klingenhofstraße 5,90411,Nürnberg,49.4751761000000,11.106745300000,Point,https://odl-nbg.de/de,HackerSpace,"Das Open Device Lab Nürnberg bietet lokale Web-Entwickler die Möglichkeit, ihre Webseiten und Apps auf einer ständig wachsenden Auswahl mobiler Endgeräte zu testen. Es befindet sich in den Agenturräumen der tollwerk GmbH und wird nach vorheriger Terminvereinbarung zu den üblichen Geschäftszeiten besucht werden können. Es unterstützt die lokale Entwicklergemeinschaft, indem es Zugang zu vielfältigen Testgeräten ermöglicht und damit zur Qualitätssicherung von Webanwendungen beiträgt.",Testlabor für mobile Endgeräte,"Bereitstellung einer Auswahl an mobilen Endgeräten zur Testung von Web-Entwicklungen, Unterstützung von Entwicklern bei praktischen Tests","Programmierer, Nerds, Hacker, Geeks, Interessierte an Technologie"
Otto-Friedrich-Universität Bamberg,Kapuzinerstraße 16,96047,Bamberg,49.8938763000000,10.886080800000,Point,https://www.uni-bamberg.de/,Universitäre und außeruniversitäre Forschung,"Die Otto-Friedrich-Universität Bamberg ist eine renommierte Hochschule, die sich durch eine Vielzahl von Studiengängen und eine starke Forschungsausrichtung auszeichnet. Sie bietet ein internationales und dynamisches Studienumfeld und betont die Bedeutung der interdisziplinären Forschung. Die Universität ist bestrebt, neue Erkenntnisse zu gewinnen und innovative Lösungen zu entwickeln.",Volluniversität,"Studienangebote, Forschungsprojekte, Innovationsförderung","Studieninteressierte, Studierende, Forschende, Wissenschaftler, Lehrende, Wissenschaftscommunity"
PINC Spaces,Lenzstraße 5,90408,Nürnberg,49.4710237000000,11.079556000000,Point,https://www.pinc-spaces.de/,Coworking Space,"PINC Spaces in Nürnberg bietet vielseitig nutzbare Räumlichkeiten für eine breite Palette von Veranstaltungen. Mit einem gemütlichen Garten, der zum Grillen einlädt, sowie verschiedenen Räumen für Meetings und Seminare, ist es ein idealer Ort für den kreativen und inspirierten Austausch. PINC Spaces unterstützt bei der Organisation von Events, von Catering bis hin zum technischen Setup, um sicherzustellen, dass jede Veranstaltung reibungslos verläuft.","Ort für Veranstaltungen, Workshops und Seminare","Meetingräume, Seminarraum, Coworking Space, PINC Garden, Catering, Event-Organisation, Setup, Räume für Yoga-Sessions, Veranstaltungen wie Lesungen, Konferenzen und Seminare","Freiberufler, Selbständige, Teams, Unternehmen"
"Regus - Nuernberg, City Center ZeltnerEck",Zeltnerstraße 1-3,90443,Nürnberg,49.4467579000000,11.071882700000,Point,https://www.regus.com/de-de,Coworking Space,"Regus in Nürnberg bietet ein breites Spektrum an Büro- und Arbeitsplatzlösungen. Es ist ideal für Unternehmen, Freelancer und Start-ups, die flexible Arbeitsplatzoptionen in einer professionellen Umgebung suchen. Mit modern ausgestatteten Räumen und umfassenden Dienstleistungen wie Highspeed-Internet, Telefon- und Empfangsservice sowie Konferenzräumen, erfüllt Regus Seetor die Bedürfnisse einer breiten Palette von Geschäftsanforderungen.","Arbeitsplatz, Meeting- und Eventraum","Büroräume, Coworking-Plätze, virtuelle Büros, Konferenz- und Tagungsräume, Hot Desks, Tagesbüros, Büro-Mitgliedschaft, Tages-Coworking, Geschäftsadresse, Telefon- und Empfangsservice, Konferenzräume, Schulungsräume, Boardrooms, 24/7 Zugang, Highspeed Internet","Freiberufler, Selbständige,Programmierer, Teams, Unternehmen"
StartUp Factory GmbH,Laubanger 17 h,96052,Bamberg,49.9107755000000,10.873514702567,Point,https://www.startup-factory.org/,"Coworking Space,Accelerator", "Die StartUp Factory in Bamberg bietet moderne Räumlichkeiten für Business-Meetings, Seminare und kulturelle Veranstaltungen. Neben den Raumvermietungen für geschäftliche Zwecke engagiert sich die StartUp Factory auch im kulturellen Bereich, unter anderem als Sponsor des Blues und Jazz Festivals in Bamberg. Sie bietet damit eine Plattform, die sowohl geschäftliche als auch kulturelle Interessen bedient.","Ort für Meetings, Seminare und kulturelle Veranstaltungen","Vermietung von modernen Meeting- und Seminarraum, Bühne für Veranstaltungen, Partner und Sponsor des Blues und Jazz Festivals Bamberg","Unternehmen, Veranstalter, Interessierte an Kultur"
Startup.Digital.Nürnberg,Kleestraße 21-23,90461,Nürnberg,49.4337975061844,11.091840857697,Point,https://startup-digital.nuernberg.de/,"Gründerzentrum,Accelerator", "Startup.Digital.Nürnberg, ein Teil der Klee-Center GmbH und Tochtergesellschaft der Stadt Nürnberg, bietet Büroräume, Coaching und Netzwerkmöglichkeiten für Gründer und Start-ups. Als Innovationsmotor für die Region unterstützt es Unternehmen bei der Entwicklung und Vernetzung.",Innovationsmotor für die Region,"Hochwertige, attraktiv ausgestattete Büroräume, Einzel- und Teamcoaching, Multiplikatoren und Interaktionen, Veranstaltungen","Start-ups, Unternehmengründer"
"Studio R5 - Coworking, Offsite Location",Rosenaustraße 5,90429,Nürnberg,49.4498135000000,11.062737200000,Point,,Coworking Space,"Studio R5 bietet in einem schönen, großen Studio am Rosenaupark konzentriertes Arbeiten in schöner Atmosphäre und mit viel Platz. Es gibt feste und tageweise buchbare Arbeitsplätze sowie einen separaten Raum für ungestörte Meetings oder Kundenbesuche",Coworking Space und Offsite Location,"Schreibtisch-/Arbeitsplatzvermietung, separater Besprechungsraum, kleine Küche mit Kaffee/Tee und der Möglichkeit etwas zu kochen, zentrale Lage","Freiberufler, Selbständige, Kreative, Programmierer, Teams"
Technische Hochschule Nürnberg,Keßlerplatz 12,90489,Nürnberg,49.4522688000000,11.093469200000,Point,https://www.th-nuernberg.de/,Universitäre und außeruniversitäre Forschung,"Die Technische Hochschule Nürnberg ist eine Bildungs- und Forschungseinrichtung, die ein vielfältiges Angebot an Studiengängen und Weiterbildungsmöglichkeiten bietet. Sie ist aktiv in der Forschung, insbesondere in Bereichen wie angewandter Informatik und Energiesysteme. Die Hochschule ist auch international ausgerichtet und bietet verschiedene Programme und Projekte an, die Innovation und interdisziplinäre Zusammenarbeit fördern.",Hochschule,"Studienangebote, Weiterbildung, Forschungsprojekte","Studieninteressierte, Studierende, Forschende, Wissenschaftler, Lehrende, Wissenschaftscommunity"
